Ansprechpartner;Link;Beschreibung
Verbraucherzentrale Mecklenburg-Vorpommern;https://www.verbraucherzentrale-mv.eu/wissen/energie;Energieberatungsstelle der Verbraucherzentrale MV
Effizienzklassen Rechner (Heizkessel);https://www.bmwi.de/Redaktion/DE/Infografiken/Energie/effizienzklassen-rechner.html;
HeizCheck;https://www.co2online.de/service/energiesparchecks/heizcheck/;
Sanierungskonfigurator;http://www.sanierungskonfigurator.de/;Mit Angaben des Ist-Zustandes des Gebäudes können verschiedenen Sanierungsszenarien angeschaut werden
Energieberatung für Privatpersonen;https://www.deutschland-machts-effizient.de/KAENEF/Redaktion/DE/Foerderprogramme/A-energieberatung-verbraucherzentrale-bundesverband.html;Beratung für Strom- und Wärmeverbrauch, Unterstützung einkommensschwacher Haushalte
Energieberatung für Wohngebäude;https://www.deutschland-machts-effizient.de/KAENEF/Redaktion/DE/Foerderprogramme/energieberatung-wohngebaeude.html;Überprüfung des Energieverbrauchs der Immobilie mit anschließendem Sanierungskonzept
